{
 "bnapCases": 1,
 "area": "response",
 "title": "The Response, the receipt rules and errors",
 "schema": "schema/response.schema.json",
 "generator": "conformance/gen_cases.py",
 "source": "spec/socket-draft-00.md (doc rev 39), spec/ERRATA.md, spec/DECISIONS.md, registry/generated/registry.json, reference/python/bnap_ref.py",
 "numberOfTests": 80,
 "header": [
  "Responses are signed by the receipt key SHA-256(\"bnap test receipt key\") (draft-00 8.1).",
  "ClientReceiptCheck applies 9.3 \"on a receipt\" and binds the receipt to the request the",
  "client sent: its Digest, its OfferID and, where the offer allows, the charge."
 ],
 "notes": {
  "Valid": {
   "bugType": "BASIC",
   "description": "A well-formed input every implementation must accept."
  },
  "Structure": {
   "bugType": "MALFORMED",
   "description": "A required record missing or a bad value."
  },
  "Version": {
   "bugType": "VERSION",
   "description": "An unsupported socket version."
  },
  "Size": {
   "bugType": "TOO_LARGE",
   "description": "Over 8,192 bytes."
  },
  "Ack": {
   "bugType": "CLIENT_REJECT",
   "description": "The ack does not verify: a record changed after signing."
  },
  "Key": {
   "bugType": "CLIENT_REJECT",
   "description": "The receipt key is not pinned for use receipt at settled_at."
  },
  "Clock": {
   "bugType": "CLIENT_REJECT",
   "description": "settled_at more than 60 s from the client's clock, without replayed."
  },
  "Binding": {
   "bugType": "CLIENT_REJECT",
   "description": "The receipt answers another request or charges something else."
  },
  "UnknownOdd": {
   "bugType": "BASIC",
   "description": "An unknown odd record."
  },
  "Replayed": {
   "bugType": "BASIC",
   "description": "A replayed receipt keeps the original settled_at."
  }
 },
 "testGroups": [
  {
   "type": "ResponseParse",
   "section": "8.1",
   "description": "Parse a Response and check the ack.",
   "tests": [
    {
     "tcId": 1,
     "comment": "draft-00 section 14 Response",
     "flags": [
      "Valid"
     ],
     "sections": [
      "8.1"
     ],
     "inputs": {
      "response": "00010102000602015408037361740a205c8640261f6f1de3206a2e9cd1c2599a2e9256547242061c95f9d2e06cf6696d0c207c8f6196ad3adb3cf3199c1ebb79ef8b84ae26d20a01f3a89e336666d530d4c90e020352101d6368616e6765207369676e61747572657320706c616365686f6c64657212205f49b61a80a8105a2f727c4c53ee1718252b1e8bc05f6c62f0242e56286b83db14046acb2c4af040c1d4270a82036d4b4c89f0d39ad62ea3a541fcd299eca075a02a7b1e04ee01ef784a08eba0996365ae8acb460ae0ee7474602381eba209456ab629bfef6f70f7",
      "max_response": 8192
     },
     "result": "valid",
     "expected": {
      "status": "OK",
      "replayed": false,
      "charged": 340,
      "unit": "sat",
      "metered_units": 850,
      "settled_at": 1791700042,
      "ack_valid": true
     }
    },
    {
     "tcId": 2,
     "comment": "status missing",
     "flags": [
      "Structure"
     ],
     "sections": [
      "8.1"
     ],
     "inputs": {
      "response": "0001010602015408037361740a205c8640261f6f1de3206a2e9cd1c2599a2e9256547242061c95f9d2e06cf6696d0c207c8f6196ad3adb3cf3199c1ebb79ef8b84ae26d20a01f3a89e336666d530d4c90e020352101d6368616e6765207369676e61747572657320706c616365686f6c64657212205f49b61a80a8105a2f727c4c53ee1718252b1e8bc05f6c62f0242e56286b83db14046acb2c4af0408c4809e6ff2fde6dbc5766cff3db1db8782a28a02a4301cd854d9b72a4021955b7bb811e123c6c8e68b3df3031b782877b02d3fb063ba29716e8237099a9c1ca",
      "max_response": 8192
     },
     "result": "invalid",
     "error": "MALFORMED",
     "errorCode": 2
    },
    {
     "tcId": 3,
     "comment": "charged missing",
     "flags": [
      "Structure"
     ],
     "sections": [
      "8.1"
     ],
     "inputs": {
      "response": "000101020008037361740a205c8640261f6f1de3206a2e9cd1c2599a2e9256547242061c95f9d2e06cf6696d0c207c8f6196ad3adb3cf3199c1ebb79ef8b84ae26d20a01f3a89e336666d530d4c90e020352101d6368616e6765207369676e61747572657320706c616365686f6c64657212205f49b61a80a8105a2f727c4c53ee1718252b1e8bc05f6c62f0242e56286b83db14046acb2c4af04085bd8b133228574ea4b0339a1182b0f64f975a2e9c6354ddbcc0fbb9322ad19dfc78e4ca0641bb2ed4f9122efdb5e290c6b250d2b19b1d25b777c087d83d0e87",
      "max_response": 8192
     },
     "result": "invalid",
     "error": "MALFORMED",
     "errorCode": 2
    },
    {
     "tcId": 4,
     "comment": "offer_id missing",
     "flags": [
      "Structure"
     ],
     "sections": [
      "8.1"
     ],
     "inputs": {
      "response": "00010102000602015408037361740c207c8f6196ad3adb3cf3199c1ebb79ef8b84ae26d20a01f3a89e336666d530d4c90e020352101d6368616e6765207369676e61747572657320706c616365686f6c64657212205f49b61a80a8105a2f727c4c53ee1718252b1e8bc05f6c62f0242e56286b83db14046acb2c4af04026a751ec6508673297c446f8c0989d3c204c9b277f3c39f3ece8e6999aa43fc8965575fc9a1365d8e023e636af55e31edb1f52bdd29ce54f4e4ad0ad2bd42f48",
      "max_response": 8192
     },
     "result": "invalid",
     "error": "MALFORMED",
     "errorCode": 2
    },
    {
     "tcId": 5,
     "comment": "digest missing",
     "flags": [
      "Structure"
     ],
     "sections": [
      "8.1"
     ],
     "inputs": {
      "response": "00010102000602015408037361740a205c8640261f6f1de3206a2e9cd1c2599a2e9256547242061c95f9d2e06cf6696d0e020352101d6368616e6765207369676e61747572657320706c616365686f6c64657212205f49b61a80a8105a2f727c4c53ee1718252b1e8bc05f6c62f0242e56286b83db14046acb2c4af040dff58f9abf44fa49da4725aa61702a42927457dbb245162a3e4a44ace0807f527de829744a7153190a33e230a760868f32e0934d2919734fad6d63b986215593",
      "max_response": 8192
     },
     "result": "invalid",
     "error": "MALFORMED",
     "errorCode": 2
    },
    {
     "tcId": 6,
     "comment": "receipt_key missing",
     "flags": [
      "Structure"
     ],
     "sections": [
      "8.1"
     ],
     "inputs": {
      "response": "00010102000602015408037361740a205c8640261f6f1de3206a2e9cd1c2599a2e9256547242061c95f9d2e06cf6696d0c207c8f6196ad3adb3cf3199c1ebb79ef8b84ae26d20a01f3a89e336666d530d4c90e020352101d6368616e6765207369676e61747572657320706c616365686f6c64657214046acb2c4af0409af19c08e192e63b2c7e892b47bc496c3f2450c1366cb3d49d2c9a1cad085ebba3333867d13d70ab8c2041db50d3962344e0351035ef4f50045f0cb400e91024",
      "max_response": 8192
     },
     "result": "invalid",
     "error": "MALFORMED",
     "errorCode": 2
    },
    {
     "tcId": 7,
     "comment": "settled_at missing",
     "flags": [
      "Structure"
     ],
     "sections": [
      "8.1"
     ],
     "inputs": {
      "response": "00010102000602015408037361740a205c8640261f6f1de3206a2e9cd1c2599a2e9256547242061c95f9d2e06cf6696d0c207c8f6196ad3adb3cf3199c1ebb79ef8b84ae26d20a01f3a89e336666d530d4c90e020352101d6368616e6765207369676e61747572657320706c616365686f6c64657212205f49b61a80a8105a2f727c4c53ee1718252b1e8bc05f6c62f0242e56286b83dbf0402a8410bde8b03c105d91649672a3f5ea061d94c1d839f9ac029c0485d12da6c0e9e9043af271242062b198051cacd4bc31f986ea1b5ad86d6af3592156df3eae",
      "max_response": 8192
     },
     "result": "invalid",
     "error": "MALFORMED",
     "errorCode": 2
    },
    {
     "tcId": 8,
     "comment": "ack missing",
     "flags": [
      "Structure"
     ],
     "sections": [
      "8.1"
     ],
     "inputs": {
      "response": "00010102000602015408037361740a205c8640261f6f1de3206a2e9cd1c2599a2e9256547242061c95f9d2e06cf6696d0c207c8f6196ad3adb3cf3199c1ebb79ef8b84ae26d20a01f3a89e336666d530d4c90e020352101d6368616e6765207369676e61747572657320706c616365686f6c64657212205f49b61a80a8105a2f727c4c53ee1718252b1e8bc05f6c62f0242e56286b83db14046acb2c4a",
      "max_response": 8192
     },
     "result": "invalid",
     "error": "MALFORMED",
     "errorCode": 2
    },
    {
     "tcId": 9,
     "comment": "status 2",
     "flags": [
      "Structure"
     ],
     "sections": [
      "8.1"
     ],
     "inputs": {
      "response": "00010102010206000a2000000000000000000000000000000000000000000000000000000000000000000c20000000000000000000000000000000000000000000000000000000000000000012205f49b61a80a8105a2f727c4c53ee1718252b1e8bc05f6c62f0242e56286b83db14046acb2c84f04041194568c0cdc4f5dcf7bc85c06ed202f7543744e5871dc69b0bfc25cf9161348d028718d15fd85a8400a92f5c157b28b5a94b4ead1de1069c007d343455fb0d",
      "max_response": 8192
     },
     "result": "invalid",
     "error": "MALFORMED",
     "errorCode": 2
    },
    {
     "tcId": 10,
     "comment": "replayed flag with a value",
     "flags": [
      "Structure"
     ],
     "sections": [
      "8.1"
     ],
     "inputs": {
      "response": "00010102000401010602015408037361740a205c8640261f6f1de3206a2e9cd1c2599a2e9256547242061c95f9d2e06cf6696d0c207c8f6196ad3adb3cf3199c1ebb79ef8b84ae26d20a01f3a89e336666d530d4c90e020352101d6368616e6765207369676e61747572657320706c616365686f6c64657212205f49b61a80a8105a2f727c4c53ee1718252b1e8bc05f6c62f0242e56286b83db14046acb2c4af040c1d4270a82036d4b4c89f0d39ad62ea3a541fcd299eca075a02a7b1e04ee01ef784a08eba0996365ae8acb460ae0ee7474602381eba209456ab629bfef6f70f7",
      "max_response": 8192
     },
     "result": "invalid",
     "error": "MALFORMED",
     "errorCode": 2
    },
    {
     "tcId": 11,
     "comment": "version 2",
     "flags": [
      "Version"
     ],
     "sections": [
      "8.1"
     ],
     "inputs": {
      "response": "00010202000602015408037361740a205c8640261f6f1de3206a2e9cd1c2599a2e9256547242061c95f9d2e06cf6696d0c207c8f6196ad3adb3cf3199c1ebb79ef8b84ae26d20a01f3a89e336666d530d4c90e020352101d6368616e6765207369676e61747572657320706c616365686f6c64657212205f49b61a80a8105a2f727c4c53ee1718252b1e8bc05f6c62f0242e56286b83db14046acb2c4af040c1d4270a82036d4b4c89f0d39ad62ea3a541fcd299eca075a02a7b1e04ee01ef784a08eba0996365ae8acb460ae0ee7474602381eba209456ab629bfef6f70f7",
      "max_response": 8192
     },
     "result": "invalid",
     "error": "VERSION",
     "errorCode": 1
    },
    {
     "tcId": 12,
     "comment": "digest of 31 bytes",
     "flags": [
      "Structure"
     ],
     "sections": [
      "8.1"
     ],
     "inputs": {